method_id,display_name,method_family,baseline_role,fidelity_grade,main_table_status,paper_usage,source_summary,source_table,target_count,valid_completed_count,success_count,method_failure_count,pending_count,success_rate,paper_ready,adaptation_label,required_label,notes
fixed_representative,Fixed representative,internal_ablation,internal_ownership_ablation,D,appendix_or_internal_ablation,appendix_or_ablation,results/processed/paper_stats/baseline_summary.json,results/tables/matched_budget_baselines.csv,12,12,12,0,0,1.0,True,,,"Internal ablation, not an external active ownership baseline."
uniform_bucket,Uniform bucket,internal_ablation,internal_ownership_ablation,D,appendix_or_internal_ablation,appendix_or_ablation,results/processed/paper_stats/baseline_summary.json,results/tables/matched_budget_baselines.csv,12,12,12,0,0,1.0,True,,,"Internal ablation, not an external active ownership baseline."
english_random_active_fingerprint,English-random active fingerprint,weak_proxy,negative_diagnostic_baseline,D,appendix_negative_diagnostic,appendix_or_ablation,results/processed/paper_stats/baseline_summary.json,results/tables/matched_budget_baselines.csv,12,12,0,12,0,0.0,True,,,Weak natural-language proxy; valid failures remain in denominator.
kgw_provenance_control,KGW provenance control,task_mismatched_provenance_control,provenance_control,F_for_ownership_baseline,excluded_task_mismatched_control,related_work_or_control_only,results/processed/paper_stats/baseline_summary.json,results/tables/matched_budget_baselines.csv,0,0,0,0,0,0.0,False,,task-mismatched provenance control,Text provenance watermarking is not a primary model-ownership payload-recovery baseline.
scalable_fingerprinting_perinucleus_official_qwen_final,Scalable Fingerprinting / Perinucleus official Qwen adaptation,external_active_ownership_baseline,primary_external_baseline,A_adapted,eligible_with_adaptation_label,main_external_baseline,results/processed/paper_stats/baseline_perinucleus_official_qwen_final_summary.json,results/tables/baseline_perinucleus_official_qwen_final.csv,48,48,48,0,0,1.0,True,official-code Qwen LoRA adaptation,Qwen-adapted official Scalable/Perinucleus baseline,"Passed forensic replay, single-fingerprint overfit, Llama anchor, Qwen capacity selection, candidate utility sanity, and 48/48 final exact-verifier cases."
chain_hash_qwen_v1,Chain&Hash-style Qwen package,external_active_ownership_baseline,external_baseline_candidate,C_pending,not_eligible_pending_execution,protocol_pending_or_appendix_only,results/processed/paper_stats/baseline_chain_hash_summary.json,results/tables/baseline_chain_hash.csv,48,0,0,0,48,0.0,False,,,"Prepared package only; no final rows, calibration, utility, or anchor evidence in current artifacts."
legacy_adapted_perinucleus_diagnostic,Legacy adapted Perinucleus diagnostic,failed_or_incomplete_external_diagnostic,excluded_diagnostic,F_for_scalable_claim,excluded_do_not_use_for_scalable_claim,internal_diagnostic_only,results/processed/paper_stats/baseline_perinucleus_summary.json,results/tables/baseline_perinucleus.csv,0,0,0,0,0,0.0,False,,not Scalable Fingerprinting,Retained only as a diagnostic artifact. Do not merge into the official Perinucleus row; use baseline_perinucleus_official_qwen_final_* for paper-facing Scalable/Perinucleus claims.
